{"schema":"hexalith.module-run-evidence.v1","runId":"0123456789abcdef0123456789abcd01","timestamps":{"startedUtc":"2026-01-01T00:00:00.0000000+00:00","completedUtc":"2026-01-01T00:01:00.0000000+00:00"},"environment":{"repositoryRevision":"0123456789abcdef0123456789abcdef01234567","repositoryDirtyMarker":"clean","sdkVersion":"10.0.401","operatingSystem":"contract-os","toolVersion":"0.0.0-contract+0123456789abcdef0123456789abcdef01234567"},"invocation":{"command":"hexalith-module test --manifest test/fixtures/evidence/acceptance/bound/hexalith.module-manifest.v1.json --profile full","manifestPath":"test/fixtures/evidence/acceptance/bound/hexalith.module-manifest.v1.json","manifestHash":"C9A9DF3136D640D4345E4F56437A90E5AD8A15BCAC1A97FF95858B0AEC514209","profile":"full","fixturePath":"test/fixtures/evidence/acceptance/bound/profile-full.fixture.json","fixtureHash":"1E2DEEFA8E24C961ADEFA0F8565421EED802FE4D6F7A278DD2AE687EB429F894","filterHash":null},"topology":{"modules":[{"id":"module-a","domain":"module-a","applicationId":"module-a-app","resourceId":"module-a","descriptorAssembly":"artifacts/module-a.dll"},{"id":"module-b","domain":"module-b","applicationId":"module-b-app","resourceId":"module-b","descriptorAssembly":"artifacts/module-b.dll"}],"platform":{"eventStoreVersion":"3.120.0","daprRuntimeVersion":"1.18.2","daprSdkVersion":"1.18.10","frontComposerVersion":"4.6.0"}},"phaseOutcomes":[{"phase":"None","category":"None","ruleId":null}],"testCounts":{"reported":true,"total":2,"passed":2,"failed":0,"skipped":0},"persistedAssertions":["module-a:authenticated-write","module-a:persisted-event-and-projection","module-a:restart-and-rehydrated-read","module-a:retry-idempotency","module-a:tenant-isolation","module-a:two-instance-read","module-b:authenticated-write","module-b:persisted-event-and-projection","module-b:restart-and-rehydrated-read","module-b:retry-idempotency","module-b:tenant-isolation","module-b:two-instance-read"],"expectedSequences":["module-a:1,2","module-b:1,2"],"artifactHashes":{"test/fixtures/evidence/acceptance/bound/run-persisted-vstest-count-mismatch.vstest.trx":"381DECE65259E57A82E00EC8B8EEE14B1B661D24BEAF747A782057D9AFE758DA"},"finalStatus":"completed","outcome":{"exitCode":0,"phase":"None","category":"None","ruleId":null},"volatileFields":["artifactHashes","runId","timestamps.completedUtc","timestamps.startedUtc"]}
