{"schema":"hexalith.module-run-evidence.v1","runId":"a7a673fe483a1c2f2532a5b987d5907e","timestamps":{"startedUtc":"2026-09-25T10:24:43.5496481\u002B00:00","completedUtc":"2026-09-25T10:25:46.1419109\u002B00:00"},"environment":{"repositoryRevision":"90228a7bab43dfba1606097fb1bd97968621679a","repositoryDirtyMarker":"clean","sdkVersion":"10.0.401","operatingSystem":"Ubuntu 26.04 LTS","toolVersion":"0.0.0-stage5.8\u002B90228a7bab43dfba1606097fb1bd97968621679a"},"invocation":{"command":"hexalith-module test --manifest test/fixtures/module/executable/hexalith.module-manifest.v1.json --profile full-mtp","manifestPath":"test/fixtures/module/executable/hexalith.module-manifest.v1.json","manifestHash":"AD86271C269BE95773B718B213E990D857E53867FA444BC26163B371520DA3D7","profile":"full-mtp","fixturePath":"test/fixtures/module/executable/profiles/p0-two-module-full-mtp.fixture.json","fixtureHash":"1D92AF2BADA25D89195D084F3DF54EA2F3F4C63EC00DEB3187DCCF1DC9E4B835","filterHash":null},"topology":{"modules":[{"id":"p0-inventory","domain":"p0-inventory","applicationId":"p0-inventory-app","resourceId":"p0-inventory","descriptorAssembly":"artifacts/g4-fixture/bin/P0Fixture.Inventory.Descriptor/P0Fixture.Inventory.Descriptor.dll"},{"id":"p0-orders","domain":"p0-orders","applicationId":"p0-orders-app","resourceId":"p0-orders","descriptorAssembly":"artifacts/g4-fixture/bin/P0Fixture.Orders.Descriptor/P0Fixture.Orders.Descriptor.dll"}],"platform":{"eventStoreVersion":"3.108.1","daprRuntimeVersion":"1.18.2","daprSdkVersion":"1.18.8","frontComposerVersion":"4.5.0"}},"phaseOutcomes":[{"phase":"None","category":"None","ruleId":null}],"testCounts":{"reported":true,"total":2,"passed":2,"failed":0,"skipped":0},"persistedAssertions":["p0-inventory:authenticated-write","p0-inventory:persisted-event-and-projection","p0-inventory:restart-and-rehydrated-read","p0-inventory:retry-idempotency","p0-inventory:tenant-isolation","p0-inventory:two-instance-read","p0-orders:authenticated-write","p0-orders:persisted-event-and-projection","p0-orders:restart-and-rehydrated-read","p0-orders:retry-idempotency","p0-orders:tenant-isolation","p0-orders:two-instance-read"],"expectedSequences":["p0-inventory:1,2","p0-orders:1,2"],"artifactHashes":{"_bmad-output/implementation-artifacts/qualification-evidence/stage5-local-20260924/live-stage5.8/persisted-mtp.mtp.trx":"0A8FB0AB10231C3D366D2295C272AC46C7959CAFDCED40B4714987640D8ABC40"},"finalStatus":"completed","outcome":{"exitCode":0,"phase":"None","category":"None","ruleId":null},"volatileFields":["artifactHashes","runId","timestamps.completedUtc","timestamps.startedUtc"]}
