{"schema":"hexalith.module-run-evidence.v1","runId":"2c0e60d041f54b95a6467e7e89b3b6cf","timestamps":{"startedUtc":"2026-09-23T19:14:31.7933425\u002B00:00","completedUtc":"2026-09-23T19:14:31.9124016\u002B00:00"},"environment":{"repositoryRevision":"unavailable","repositoryDirtyMarker":"dirty","sdkVersion":"10.0.401","operatingSystem":"Ubuntu 26.04 LTS","toolVersion":"0.0.0-stage3.12\u002B2fba3497043fe5ffcfe4dc44c51a09eae9b950ab"},"invocation":{"command":"hexalith-module down --manifest test/fixtures/module/positive/hexalith.module-manifest.v1.json --filter-sha256 BD3E72EE1F7EF625435F26C9DFEF2C8CF519E15B4D4DC0CAC99CAEC5D3D2502D","manifestPath":"test/fixtures/module/positive/hexalith.module-manifest.v1.json","manifestHash":"CA112F368BA55F91C05FFCCB302C4133698331FE463AEF0F875B93870BC57A96","profile":null,"fixturePath":null,"fixtureHash":null,"filterHash":"BD3E72EE1F7EF625435F26C9DFEF2C8CF519E15B4D4DC0CAC99CAEC5D3D2502D"},"topology":{"modules":[{"id":"p0-fixture-inventory","domain":"p0-fixture-inventory-domain","applicationId":"p0-fixture-inventory-app","resourceId":"p0-fixture-inventory-resource","descriptorAssembly":"test/fixtures/module/descriptors/p0-fixture-inventory.descriptor.json"},{"id":"p0-fixture-orders","domain":"p0-fixture-orders-domain","applicationId":"p0-fixture-orders-app","resourceId":"p0-fixture-orders-resource","descriptorAssembly":"test/fixtures/module/descriptors/p0-fixture-orders.descriptor.json"}],"platform":{"eventStoreVersion":"3.106.0","daprRuntimeVersion":"1.18.2","daprSdkVersion":"1.18.8","frontComposerVersion":"4.5.0"}},"phaseOutcomes":[{"phase":"None","category":"None","ruleId":null}],"testCounts":{"reported":false,"total":0,"passed":0,"failed":0,"skipped":0},"persistedAssertions":[],"expectedSequences":[],"artifactHashes":{},"finalStatus":"completed","outcome":{"exitCode":0,"phase":"None","category":"None","ruleId":null},"volatileFields":["runId","timestamps.completedUtc","timestamps.startedUtc"]}
