{"schema":"hexalith.module-run-evidence.v1","runId":"09b0604c0c5e7d2204a73b490d645090","timestamps":{"startedUtc":"2026-09-25T10:27:06.6485612\u002B00:00","completedUtc":"2026-09-25T10:27:06.7084879\u002B00:00"},"environment":{"repositoryRevision":"90228a7bab43dfba1606097fb1bd97968621679a","repositoryDirtyMarker":"clean","sdkVersion":"10.0.401","operatingSystem":"Ubuntu 26.04 LTS","toolVersion":"0.0.0-stage5.8\u002B90228a7bab43dfba1606097fb1bd97968621679a"},"invocation":{"command":"hexalith-module down --manifest test/fixtures/module/executable/hexalith.module-manifest.v1.json --run-id 09b0604c0c5e7d2204a73b490d645090","manifestPath":"test/fixtures/module/executable/hexalith.module-manifest.v1.json","manifestHash":"AD86271C269BE95773B718B213E990D857E53867FA444BC26163B371520DA3D7","profile":null,"fixturePath":null,"fixtureHash":null,"filterHash":null},"topology":{"modules":[{"id":"p0-inventory","domain":"p0-inventory","applicationId":"p0-inventory-app","resourceId":"p0-inventory","descriptorAssembly":"artifacts/g4-fixture/bin/P0Fixture.Inventory.Descriptor/P0Fixture.Inventory.Descriptor.dll"},{"id":"p0-orders","domain":"p0-orders","applicationId":"p0-orders-app","resourceId":"p0-orders","descriptorAssembly":"artifacts/g4-fixture/bin/P0Fixture.Orders.Descriptor/P0Fixture.Orders.Descriptor.dll"}],"platform":{"eventStoreVersion":"3.108.1","daprRuntimeVersion":"1.18.2","daprSdkVersion":"1.18.8","frontComposerVersion":"4.5.0"}},"phaseOutcomes":[{"phase":"None","category":"None","ruleId":null}],"testCounts":{"reported":false,"total":0,"passed":0,"failed":0,"skipped":0},"persistedAssertions":[],"expectedSequences":[],"artifactHashes":{},"finalStatus":"completed","outcome":{"exitCode":0,"phase":"None","category":"None","ruleId":null},"volatileFields":["runId","timestamps.completedUtc","timestamps.startedUtc"]}
