{"schema":"hexalith.module-run-evidence.v1","runId":"0123456789abcdef0123456789abcdef","timestamps":{"startedUtc":"2026-07-17T10:00:00.0000000+00:00","completedUtc":"2026-07-17T10:01:00.0000000+00:00"},"environment":{"repositoryRevision":"0123456789abcdef0123456789abcdef01234567","repositoryDirtyMarker":"clean","sdkVersion":"10.0.302","operatingSystem":"contract-os","toolVersion":"0.0.0-contract"},"invocation":{"command":"hexalith-module test --manifest test/fixtures/module/positive/hexalith.module-manifest.v1.json --profile full --filter-sha256 48CDF59D03E7592647AB36F4E6177F469F5E3B5D382011DC5B59D3228778AADB","manifestPath":"test/fixtures/module/positive/hexalith.module-manifest.v1.json","manifestHash":"CA112F368BA55F91C05FFCCB302C4133698331FE463AEF0F875B93870BC57A96","profile":"full","fixturePath":"test/fixtures/module/profiles/p0-two-module-full.fixture.json","fixtureHash":"FB9EA42BF01B92A7B8C95C97086519C1418C14B54F095ED55F4E8CC8FD9864E1","filterHash":"48CDF59D03E7592647AB36F4E6177F469F5E3B5D382011DC5B59D3228778AADB"},"topology":{"modules":[{"id":"module-a","domain":"module-a","applicationId":"module-a","resourceId":"module-a","descriptorAssembly":"test/fixtures/module/assemblies/module-a.dll"},{"id":"module-b","domain":"module-b","applicationId":"module-b","resourceId":"module-b","descriptorAssembly":"test/fixtures/module/assemblies/module-b.dll"}],"platform":{"eventStoreVersion":"3.106.0","daprRuntimeVersion":"1.18.0","daprSdkVersion":"1.18.8","frontComposerVersion":"4.5.0"}},"phaseOutcomes":[{"phase":"Test","category":"None","ruleId":null}],"testCounts":{"reported":true,"total":1,"passed":1,"failed":0,"skipped":0},"persistedAssertions":[],"expectedSequences":[],"artifactHashes":{},"finalStatus":"completed","outcome":{"exitCode":0,"phase":"None","category":"None","ruleId":null},"volatileFields":[]}
