{"schema":"hexalith.module-run-evidence.v1","runId":"e5f21f33fa20440d9b5062652d01e58f","timestamps":{"startedUtc":"2026-10-01T06:04:56.8792891\u002B00:00","completedUtc":"2026-10-01T06:04:56.9476637\u002B00:00"},"environment":{"repositoryRevision":"unavailable","repositoryDirtyMarker":"dirty","sdkVersion":"10.0.401","operatingSystem":"Ubuntu 26.04 LTS","toolVersion":"4.29.1\u002B21ce044ab465ccb2adab58b3d66e394ffbecf3c2"},"invocation":{"command":"hexalith-module test --manifest test/fixtures/module/positive/hexalith.module-manifest.v1.json --profile full","manifestPath":"test/fixtures/module/positive/hexalith.module-manifest.v1.json","manifestHash":"90952FF325C5AF391849E3DC494D76753EA938868F3C4608208FD25D2EEB17E2","profile":"full","fixturePath":"test/fixtures/module/profiles/p0-two-module-full.fixture.json","fixtureHash":"FB9EA42BF01B92A7B8C95C97086519C1418C14B54F095ED55F4E8CC8FD9864E1","filterHash":null},"topology":{"modules":[{"id":"p0-fixture-inventory","domain":"p0-fixture-inventory-domain","applicationId":"p0-fixture-inventory-app","resourceId":"p0-fixture-inventory-resource","descriptorAssembly":"test/fixtures/module/descriptors/p0-fixture-inventory.descriptor.json"},{"id":"p0-fixture-orders","domain":"p0-fixture-orders-domain","applicationId":"p0-fixture-orders-app","resourceId":"p0-fixture-orders-resource","descriptorAssembly":"test/fixtures/module/descriptors/p0-fixture-orders.descriptor.json"}],"platform":{"eventStoreVersion":"3.110.0","daprRuntimeVersion":"1.18.2","daprSdkVersion":"1.18.10","frontComposerVersion":"4.5.0"}},"phaseOutcomes":[{"phase":"Prerequisite","category":"PrerequisiteUnavailable","ruleId":"HXR003"}],"testCounts":{"reported":false,"total":0,"passed":0,"failed":0,"skipped":0},"persistedAssertions":[],"expectedSequences":[],"artifactHashes":{},"finalStatus":"unavailable","outcome":{"exitCode":2,"phase":"Prerequisite","category":"PrerequisiteUnavailable","ruleId":"HXR003"},"volatileFields":["runId","timestamps.completedUtc","timestamps.startedUtc"]}
