{"schema":"hexalith.module-run-evidence.v1","runId":"0123456789abcdef0123456789abcd01","timestamps":{"startedUtc":"2026-01-01T00:00:00.0000000+00:00","completedUtc":"2026-01-01T00:01:00.0000000+00:00"},"environment":{"repositoryRevision":"0123456789abcdef0123456789abcdef01234567","repositoryDirtyMarker":"clean","sdkVersion":"10.0.401","operatingSystem":"contract-os","toolVersion":"0.0.0-contract+0123456789abcdef0123456789abcdef01234567"},"invocation":{"command":"hexalith-module down --manifest test/fixtures/evidence/acceptance/bound/hexalith.module-manifest.v1.json --run-id 0123456789abcdef0123456789abcd01","manifestPath":"test/fixtures/evidence/acceptance/bound/hexalith.module-manifest.v1.json","manifestHash":"C9A9DF3136D640D4345E4F56437A90E5AD8A15BCAC1A97FF95858B0AEC514209","profile":null,"fixturePath":null,"fixtureHash":null,"filterHash":null},"topology":{"modules":[{"id":"module-a","domain":"module-a","applicationId":"module-a-app","resourceId":"module-a","descriptorAssembly":"artifacts/module-a.dll"},{"id":"module-b","domain":"module-b","applicationId":"module-b-app","resourceId":"module-b","descriptorAssembly":"artifacts/module-b.dll"}],"platform":{"eventStoreVersion":"3.128.4","daprRuntimeVersion":"1.18.7","daprSdkVersion":"1.19.0","frontComposerVersion":"4.7.1"}},"phaseOutcomes":[{"phase":"None","category":"None","ruleId":null}],"testCounts":{"reported":false,"total":0,"passed":0,"failed":0,"skipped":0},"persistedAssertions":[],"expectedSequences":[],"artifactHashes":{},"finalStatus":"completed","outcome":{"exitCode":0,"phase":"None","category":"None","ruleId":null},"volatileFields":["runId","timestamps.completedUtc","timestamps.startedUtc"]}
