{"schema":"hexalith.module-run-evidence.v1","runId":"134f2a92bf874740b74cf569962339d0","timestamps":{"startedUtc":"2026-09-25T10:26:23.7963382\u002B00:00","completedUtc":"2026-09-25T10:27:06.0190680\u002B00:00"},"environment":{"repositoryRevision":"90228a7bab43dfba1606097fb1bd97968621679a","repositoryDirtyMarker":"clean","sdkVersion":"10.0.401","operatingSystem":"Ubuntu 26.04 LTS","toolVersion":"0.0.0-stage5.8\u002B90228a7bab43dfba1606097fb1bd97968621679a"},"invocation":{"command":"hexalith-module test --manifest test/fixtures/module/executable/hexalith.module-manifest.v1.json --profile full","manifestPath":"test/fixtures/module/executable/hexalith.module-manifest.v1.json","manifestHash":"AD86271C269BE95773B718B213E990D857E53867FA444BC26163B371520DA3D7","profile":"full","fixturePath":"test/fixtures/module/executable/profiles/p0-two-module-full.fixture.json","fixtureHash":"472AB1BECBF89C1502333BBC27838D81AFBB267141BD72639ECEECB6C794BE14","filterHash":null},"topology":{"modules":[{"id":"p0-inventory","domain":"p0-inventory","applicationId":"p0-inventory-app","resourceId":"p0-inventory","descriptorAssembly":"artifacts/g4-fixture/bin/P0Fixture.Inventory.Descriptor/P0Fixture.Inventory.Descriptor.dll"},{"id":"p0-orders","domain":"p0-orders","applicationId":"p0-orders-app","resourceId":"p0-orders","descriptorAssembly":"artifacts/g4-fixture/bin/P0Fixture.Orders.Descriptor/P0Fixture.Orders.Descriptor.dll"}],"platform":{"eventStoreVersion":"3.108.1","daprRuntimeVersion":"1.18.2","daprSdkVersion":"1.18.8","frontComposerVersion":"4.5.0"}},"phaseOutcomes":[{"phase":"Cleanup","category":"Cancelled","ruleId":"HXC130"}],"testCounts":{"reported":false,"total":0,"passed":0,"failed":0,"skipped":0},"persistedAssertions":[],"expectedSequences":[],"artifactHashes":{},"finalStatus":"cancelled","outcome":{"exitCode":130,"phase":"Cleanup","category":"Cancelled","ruleId":"HXC130"},"volatileFields":["runId","timestamps.completedUtc","timestamps.startedUtc"]}
